nom_designer,date_naissance,country,description,image
Mathieu Lehanneur,1974,France,"Mathieu Lehanneur est un designer français contemporain né en 1974. Il est reconnu pour son approche multidisciplinaire et innovante du design, combinant des éléments de technologie, de science et de nature pour créer des œuvres uniques et fonctionnelles.  Lehanneur a étudié à l'École nationale supérieure de création industrielle (ENSCI) à Paris, où il a développé son intérêt pour le design expérimental et conceptuel. Sa démarche créative repose sur une compréhension approfondie des sciences et des technologies, ainsi que sur une sensibilité esthétique aiguisée.  Son travail couvre un large éventail de domaines, allant du mobilier et de l'éclairage aux installations artistiques et aux produits de consommation. Il a collaboré avec de nombreuses marques prestigieuses et ses créations sont exposées dans des musées et des galeries à travers le monde.  Parmi ses projets les plus célèbres, on peut citer ""Bel-Air"", un système de purification de l'air inspiré par la photosynthèse des plantes, ""Andrea"", un purificateur d'air utilisant des plantes pour filtrer l'air, et ""Les Cordées"", une série de lampes modulaires inspirées par les formes organiques de la nature.  Lehanneur est également connu pour ses collaborations avec des institutions culturelles et des architectes renommés. Il a travaillé sur des projets tels que la conception d'intérieurs pour des hôtels de luxe, des installations artistiques pour des musées et des expositions, ainsi que des concepts innovants pour des espaces publics.  Son approche du design est profondément humaniste, cherchant à créer des objets et des espaces qui améliorent la vie quotidienne tout en suscitant la réflexion sur les défis contemporains tels que la santé, l'environnement et la technologie.  Mathieu Lehanneur continue d'être une figure influente dans le monde du design, explorant de nouvelles frontières et repoussant les limites de la créativité pour façonner un avenir où la beauté, la fonctionnalité et la durabilité se rencontrent harmonieusement.",https://wwd.com/wp-content/uploads/2023/09/Mathieu-Lehanneur-Leandro-Viana.jpg?w=1024
Nucleo,1997,Italie,"Le studio Nucleo est un collectif artistique et de design basé à Turin, en Italie, fondé en 1997 par Piergiorgio Robino, Stefania Fersini et Alice Carlo. Il est connu pour ses créations innovantes et expérimentales qui explorent les frontières entre l'art, le design et la science.  Les membres du studio Nucleo se sont rencontrés à l'École des beaux-arts de Turin, où ils ont développé un intérêt commun pour la recherche et l'expérimentation dans le domaine du design. Leur approche collaborative se caractérise par une volonté de repousser les limites du matériau et de la forme, ainsi que de remettre en question les conventions traditionnelles du design.  Une des caractéristiques distinctives du studio Nucleo est son utilisation innovante de matériaux, notamment la résine, le verre et les métaux, ainsi que sa fascination pour les processus de transformation et de mutation. Ils explorent souvent des concepts liés à la nature, à la géologie et à la biologie, créant des œuvres qui semblent organiques et évolutives.  Le studio Nucleo est également connu pour ses collaborations avec des entreprises et des institutions internationales, ainsi que pour ses expositions dans des galeries et des musées du monde entier. Leurs œuvres ont été présentées dans des événements majeurs tels que la Biennale de Venise, le Salone del Mobile à Milan et la Design Miami.  Au fil des ans, le studio Nucleo a acquis une reconnaissance internationale pour son approche avant-gardiste du design, recevant des prix et des distinctions pour ses réalisations novatrices. Leur travail continue d'inspirer et de fasciner, repoussant les frontières de ce que le design peut être et suscitant la réflexion sur notre relation avec le monde qui nous entoure.",https://nucleo.to/site/wp-content/uploads/2021/05/GRUPPO_02_DEF2-900x675.jpg
Salvador Dalí,1904-1989,Espagne,"Salvador Dalí, né le 11 mai 1904 à Figueras en Espagne et décédé le 23 janvier 1989, était l'un des artistes les plus célèbres et les plus extravagants du 20e siècle. Il est surtout connu pour son style surréaliste distinctif, ses œuvres iconiques et sa personnalité excentrique.  Dalí a étudié à l'École des beaux-arts de San Fernando à Madrid, où il a été influencé par le cubisme et le dadaïsme avant de se tourner vers le surréalisme. Il est devenu une figure centrale du mouvement surréaliste, aux côtés d'artistes comme André Breton et René Magritte.  Son style artistique était marqué par des images étranges, oniriques et souvent fantastiques, peuplées de symboles et de motifs récurrents tels que les montres molles, les éléphants aux longues jambes, les déserts désolés et les paysages lunaires. Il a également exploré les thèmes de la sexualité, de la religion et de la mortalité dans son travail.  En plus de sa peinture, Dalí était également un artiste polyvalent, s'essayant à la sculpture, à la photographie, à la gravure, au cinéma et même à la mode. Il a travaillé sur des projets avec des personnalités de renom telles que Walt Disney et Alfred Hitchcock.  Outre ses réalisations artistiques, Dalí était également célèbre pour son comportement excentrique et ses déclarations provocatrices. Sa personnalité flamboyante et théâtrale, associée à sa célèbre moustache en crocs, en a fait une figure emblématique de la culture populaire.  Malgré ses excès et son excentricité, Dalí reste l'un des artistes les plus influents du 20e siècle, dont l'œuvre continue d'inspirer et de fasciner les générations suivantes. Ses peintures surréalistes sont aujourd'hui des icônes de l'art moderne, et son nom est synonyme d'imagination débridée et d'originalité créative.",https://i.pinimg.com/564x/51/3c/79/513c796c05e747e235b91baf28531027.jpg
Milton Glaser,1929-2020,Etats-Unis,"Milton Glaser était un graphiste et illustrateur américain né le 26 juin 1929 à New York et décédé le 26 juin 2020. Il était célèbre pour ses contributions exceptionnelles au domaine du design graphique et de la communication visuelle.  Glaser a étudié à la Cooper Union à New York et a ensuite cofondé le studio Push Pin Studios en 1954, qui est devenu un pionnier du design graphique et a influencé toute une génération de designers. Plus tard, en 1968, Glaser a fondé sa propre entreprise, Milton Glaser, Inc., où il a continué à produire un travail innovant et emblématique.  Il est surtout connu pour son logo emblématique « I Love New York », créé en 1977 pour une campagne de promotion de la ville de New York. Ce logo est devenu un symbole universel de l'amour pour la ville et a eu un impact durable sur la culture populaire.  Glaser a également conçu de nombreuses affiches célèbres, notamment celle de Bob Dylan pour l'album ""Greatest Hits"", avec son style distinctif et expressif qui combine illustration, typographie et couleurs vives. Ses affiches sont souvent considérées comme des œuvres d'art à part entière et ont été exposées dans des musées du monde entier.  Au-delà de son travail commercial, Glaser était également un éducateur et un défenseur du design en tant que forme d'expression artistique. Il a enseigné à la School of Visual Arts de New York pendant de nombreuses années et a été un mentor pour de nombreux jeunes designers.  Tout au long de sa carrière, Milton Glaser a été récompensé par de nombreux prix et distinctions pour son travail exceptionnel, et son influence sur le design graphique et la culture visuelle reste profondément ressentie aujourd'hui. Ses créations continuent d'inspirer les designers du monde entier et son héritage perdurera à travers son œuvre intemporelle et innovante.",https://www.creativeboom.com/upload/articles/5f/5fa56cc70e30b807bdf66e0b9342036d34506979_800.jpg
Carolyn Davidson,1943,Etats-Unis,"Carolyn Davidson est une artiste graphique américaine, surtout connue pour avoir créé l'un des logos les plus emblématiques au monde : le logo Nike Swoosh. Elle est née en 1943 à Portland, dans l'Oregon, aux États-Unis.  Davidson a étudié à l'Université d'État de Portland (Portland State University), où elle a rencontré Phil Knight, le fondateur de Nike. À l'époque, Knight était encore étudiant et travaillait sur la création d'une nouvelle entreprise de chaussures de sport. Il a embauché Davidson, qui était étudiante en design graphique, pour concevoir un logo pour sa nouvelle marque.  En 1971, Davidson a présenté plusieurs propositions de logos à Knight et à son équipe. Parmi elles se trouvait le célèbre Swoosh, un symbole fluide représentant un mouvement dynamique. Bien que Knight n'ait pas été immédiatement convaincu par le logo, il a fini par le choisir, et Davidson a été payée 35 dollars pour son travail.  Le logo Swoosh est rapidement devenu l'un des symboles les plus reconnaissables et les plus réussis de l'histoire du design. Il incarne l'énergie, le mouvement et la vitesse, ce qui correspond parfaitement à l'image de Nike en tant que marque de sport de premier plan.  Bien que Davidson soit surtout connue pour son travail sur le logo Nike, elle a poursuivi une carrière dans le design graphique et l'enseignement. Elle a travaillé comme designer indépendante pendant de nombreuses années et a enseigné le design à l'Université d'État de Portland.  En reconnaissance de sa contribution exceptionnelle au design, Davidson a finalement reçu davantage de compensation de la part de Nike, ainsi que des actions de la société. Son travail illustre la puissance du design graphique pour créer des symboles puissants et durables qui résistent à l'épreuve du temps.",https://www.nicekicks.com/files/2017/03/Carolyn-Davidson-.jpg
Rob Janoff,1950,Etats-Unis,"Rob Janoff est un graphiste américain célèbre pour avoir créé l'un des logos les plus emblématiques de tous les temps : le logo Apple, avec sa pomme croquée. Il est né en 1952.  Janoff a étudié le design graphique à l'Université d'État de San Jose, en Californie. Après avoir obtenu son diplôme, il a travaillé pour diverses agences de publicité et de design avant de fonder sa propre société, appelée Rob Janoff Design, en 1989.  En 1977, Janoff a été embauché par Regis McKenna Inc., une agence de publicité basée à Silicon Valley, pour créer un logo pour une nouvelle entreprise d'ordinateurs appelée Apple Computer Company, fondée par Steve Jobs, Steve Wozniak et Ronald Wayne.  Janoff a conçu un logo simple mais mémorable : une pomme avec une bouchée, surmontée d'un arc-en-ciel. Selon Janoff lui-même, l'idée de la pomme était une référence évidente au nom de l'entreprise, tandis que la bouchée était à la fois pratique (pour éviter toute confusion avec une cerise) et symbolique, représentant le fait de mordre dans la connaissance ou la créativité.  Le logo Apple conçu par Janoff est rapidement devenu l'un des logos les plus reconnaissables au monde et a évolué avec le temps pour s'adapter aux changements de la marque. Il est devenu un symbole de l'innovation, du design élégant et de la simplicité.  Après avoir travaillé sur le logo Apple, Janoff a continué à travailler comme graphiste indépendant, travaillant sur divers projets de conception graphique pour des entreprises et des organisations du monde entier. Son travail sur le logo Apple reste une contribution significative au domaine du design graphique et de la culture populaire.",https://reverttosaved.com/wp-content/uploads/2011/02/rob-janoff.jpg
Jim Schindler,1942,Etats-Unis,"Jim Schindler est un artiste et designer américain qui s'est principalement fait connaître pour son travail dans l'industrie du jeu vidéo. Il a travaillé comme concepteur artistique et directeur artistique sur plusieurs titres de jeux vidéo notables.  Schindler est surtout connu pour son travail chez Blizzard Entertainment, un célèbre développeur de jeux vidéo. Il a rejoint Blizzard dans les années 1990 et a contribué de manière significative à certains des jeux les plus emblématiques de l'entreprise, notamment la série Diablo.  En tant que directeur artistique, Schindler a joué un rôle clé dans la création de l'univers visuel de Diablo, contribuant au design des personnages, des environnements et des éléments artistiques du jeu. Son travail a contribué à établir l'esthétique sombre et immersive qui est devenue une marque de fabrique de la série Diablo.  En plus de son travail chez Blizzard, Schindler a également travaillé sur d'autres jeux vidéo et projets artistiques au cours de sa carrière. Son style distinctif et son talent pour créer des mondes visuellement riches et évocateurs ont fait de lui une figure respectée dans l'industrie du jeu vidéo.  Malheureusement, il semble que les informations spécifiques sur Jim Schindler soient relativement limitées, car il n'est peut-être pas aussi largement documenté que certains autres artistes et concepteurs de jeux vidéo. Cependant, son héritage perdure à travers les jeux auxquels il a contribué, et il reste une figure appréciée parmi les fans de jeux vidéo et les professionnels de l'industrie.",https://approval.studio/wp-content/uploads/2020/09/mac4.jpg
Matali Crasset,1965,France,"Matali Crasset est une designer française contemporaine, née le 28 novembre 1965 à Châlons-en-Champagne, en France. Elle est reconnue pour son approche novatrice et multidisciplinaire du design, explorant les frontières entre l'art, le design industriel et l'architecture.  Crasset a étudié le design industriel à l'École nationale supérieure de création industrielle (ENSCI) à Paris, où elle a développé sa philosophie de conception axée sur l'expérimentation, la fonctionnalité et l'interaction humaine. Elle a commencé sa carrière en travaillant avec le designer Philippe Starck avant de fonder son propre studio de design en 1998.  Son travail est caractérisé par son approche ludique, son engagement envers la durabilité et son exploration des besoins et des comportements humains dans des contextes divers. Elle crée des objets et des espaces qui invitent à l'interaction et à la participation, souvent en utilisant des formes simples et des matériaux naturels.  Crasset a réalisé de nombreux projets dans des domaines variés, notamment le mobilier, l'éclairage, les textiles, les installations artistiques, l'architecture intérieure et la scénographie. Ses créations sont souvent empreintes d'une sensibilité poétique et d'une volonté de repousser les limites du design conventionnel.  Parmi ses réalisations notables, on peut citer la conception de chambres d'hôtel atypiques pour l'Hôtel Hi Matic à Paris, le design d'intérieur pour le restaurant gastronomique Les Daroles à Montpellier, ainsi que des collaborations avec des marques renommées telles que Danone, Lacoste et Alessi.  En plus de sa pratique de designer, Crasset enseigne également le design dans diverses institutions à travers le monde et participe à des conférences et des expositions internationales. Son influence sur le design contemporain se manifeste par sa capacité à réimaginer les espaces et les objets du quotidien de manière innovante et significative.",https://img.lemde.fr/2021/03/31/0/0/4252/5669/664/0/75/0/4dc937e_864302873-img-8279-1.jpg
Alessandro Mendini,1931-2019,Italie,"Alessandro Mendini était un architecte, designer et théoricien italien, né le 16 août 1931 à Milan et décédé le 18 février 2019. Il était l'une des figures les plus influentes du design contemporain, reconnu pour son approche éclectique, expérimentale et pleine d'esprit.  Mendini a étudié l'architecture à l'École polytechnique de Milan, où il a été influencé par le mouvement radical italien des années 1960 et 1970, qui remettait en question les conventions du design et de l'architecture. Il a été l'un des membres fondateurs du groupe de design avant-gardiste ""Alchimia"" en 1979, aux côtés d'autres designers éminents tels que Ettore Sottsass.  Il est surtout connu pour son travail dans le domaine du design industriel et de l'architecture, mais il a également exploré d'autres formes d'expression artistique, y compris la peinture, la sculpture et la théorie du design. Son approche du design était souvent provocante, combinant des références historiques et culturelles avec un sens de l'ironie et de la fantaisie.  Parmi ses œuvres les plus célèbres, on peut citer la chaise ""Proust"" (1978), qui revisite le style du pointillisme du peintre français Georges Seurat, ainsi que la fameuse cafetière ""Anna G"" (1994) pour Alessi, qui est devenue un symbole emblématique du design contemporain.  Mendini a également joué un rôle important en tant que critique et théoricien du design, contribuant à la réflexion sur les tendances et les enjeux du design contemporain. Il a écrit de nombreux essais sur le design et l'architecture, et il a été rédacteur en chef de plusieurs revues de design influentes.  Tout au long de sa carrière, Alessandro Mendini a reçu de nombreux prix et distinctions pour son travail innovant et influent dans le domaine du design. Son héritage perdure à travers ses créations iconiques, son engagement envers l'expérimentation et sa capacité à défier les conventions du design et de l'art.",https://www.domusweb.it/content/dam/domusweb/it/Designer/2017/05/01/alessandro-mendini/Mendini.jpg.foto.rmedium.jpg
Keim édition,2012,France,"Keim Edition est une marque de vélos en bois créée par le designer Paule Guérin en collaboration avec l'ébéniste Till Breitfuss. Cette collaboration résulte de la rencontre entre le design contemporain et le savoir-faire artisanal traditionnel dans le domaine de la menuiserie.  Les vélos Keim Edition se distinguent par leur esthétique élégante et leur construction artisanale en bois. Chaque vélo est fabriqué à la main avec une grande attention aux détails, ce qui en fait des pièces uniques et haut de gamme.  L'utilisation du bois comme matériau principal confère aux vélos Keim Edition une allure intemporelle et une sensation de qualité artisanale. De plus, le bois offre des propriétés naturelles telles que la durabilité, la résistance et la légèreté, ce qui en fait un choix de matériau attrayant pour la construction de vélos.  Outre leur aspect esthétique, les vélos Keim Edition sont également conçus pour offrir une expérience de conduite confortable et agréable. Ils sont équipés de composants de haute qualité et bénéficient d'une conception ergonomique pour assurer une performance optimale sur la route.  En résumé, Keim Edition incarne la fusion entre le design contemporain, l'artisanat traditionnel et l'innovation dans le domaine du cyclisme. Ces vélos uniques attirent l'attention par leur esthétique remarquable et leur qualité de fabrication, offrant aux passionnés de vélo une option sophistiquée et exclusive pour leurs déplacements urbains ou leurs promenades à la campagne.",https://saywhofr.fra1.cdn.digitaloceanspaces.com/app/uploads/2021/09/portraits.jpeg
Marcel Bich,1914,Italie,"Keim Edition est une marque de vélos en bois créée par le designer Paule Guérin en collaboration avec l'ébéniste Till Breitfuss. Cette collaboration résulte de la rencontre entre le design contemporain et le savoir-faire artisanal traditionnel dans le domaine de la menuiserie.  Les vélos Keim Edition se distinguent par leur esthétique élégante et leur construction artisanale en bois. Chaque vélo est fabriqué à la main avec une grande attention aux détails, ce qui en fait des pièces uniques et haut de gamme.  L'utilisation du bois comme matériau principal confère aux vélos Keim Edition une allure intemporelle et une sensation de qualité artisanale. De plus, le bois offre des propriétés naturelles telles que la durabilité, la résistance et la légèreté, ce qui en fait un choix de matériau attrayant pour la construction de vélos.  Outre leur aspect esthétique, les vélos Keim Edition sont également conçus pour offrir une expérience de conduite confortable et agréable. Ils sont équipés de composants de haute qualité et bénéficient d'une conception ergonomique pour assurer une performance optimale sur la route.  En résumé, Keim Edition incarne la fusion entre le design contemporain, l'artisanat traditionnel et l'innovation dans le domaine du cyclisme. Ces vélos uniques attirent l'attention par leur esthétique remarquable et leur qualité de fabrication, offrant aux passionnés de vélo une option sophistiquée et exclusive pour leurs déplacements urbains ou leurs promenades à la campagne.",https://inspire-media.fr/wp-content/uploads/2023/06/marcel-bich-bruno-bich-1024x576.jpg
Bold-Design,2008,France,"Bold Design est une agence de design multidisciplinaire basée à Paris, en France. Fondée par le designer français Philippe Da Silva, Bold Design se distingue par son approche innovante et créative dans les domaines du design produit, du design graphique et de l'architecture d'intérieur.  L'agence Bold Design est réputée pour son expertise dans la création de solutions de design sur mesure qui répondent aux besoins spécifiques de ses clients. Que ce soit pour des projets commerciaux, résidentiels ou culturels, Bold Design met l'accent sur la collaboration étroite avec ses clients pour créer des espaces et des produits uniques et fonctionnels.  Philippe Da Silva, le fondateur de Bold Design, a une longue expérience dans le domaine du design et de l'architecture. Avant de fonder Bold Design, il a travaillé avec plusieurs agences de design renommées, acquérant ainsi une expertise diversifiée dans différents domaines du design.  Bold Design se distingue par son approche holistique du design, qui intègre des considérations esthétiques, fonctionnelles, environnementales et sociales dans chaque projet. L'agence s'efforce également d'adopter des pratiques durables et responsables dans tous ses projets, en mettant l'accent sur l'utilisation de matériaux écologiques et la réduction de l'empreinte environnementale.  En résumé, Bold Design est une agence de design dynamique et innovante qui se démarque par son approche créative et son engagement envers l'excellence dans tous les aspects de ses projets. Avec son équipe talentueuse et son portfolio diversifié, Bold Design continue de repousser les limites du design pour créer des espaces et des produits qui inspirent et enrichissent la vie quotidienne.",https://bold-design.fr/wp-content/uploads/2016/01/logo_bold2016_FB.gif
Manuelle Gautrand,1961,France,"Manuelle Gautrand est une architecte française renommée, née le 9 novembre 1961 à Marseille. Elle est reconnue pour son approche innovante et poétique de l'architecture contemporaine, qui se distingue par son attention particulière aux formes, à la lumière et à la couleur.  Gautrand a étudié l'architecture à l'École nationale supérieure d'architecture de Montpellier, où elle a obtenu son diplôme en 1985. Elle a ensuite fondé son agence, Manuelle Gautrand Architecture, à Paris en 1991. Depuis lors, son agence a travaillé sur de nombreux projets d'envergure à travers le monde, allant des bâtiments publics aux espaces culturels en passant par les projets commerciaux et résidentiels.  L'approche architecturale de Gautrand se caractérise par son exploration audacieuse des formes, des matériaux et des textures. Elle est connue pour créer des bâtiments iconiques qui deviennent souvent des repères urbains et des points de repère dans leur environnement.  Parmi ses réalisations les plus célèbres, on peut citer le Cinéma Gaumont-Pathé Alésia à Paris, le Musée des Confluences à Lyon, la Cité de la Musique de la Philharmonie de Paris, et la Tour La Marseillaise à Marseille.  Gautrand a reçu de nombreux prix prestigieux pour son travail, dont le Grand Prix national de l'architecture en France en 2017, qui récompense l'ensemble de sa carrière et sa contribution exceptionnelle à l'architecture contemporaine.  En plus de sa pratique professionnelle, Manuelle Gautrand enseigne également à l'École d'Architecture de la Ville et des Territoires à Marne-la-Vallée, en France. Elle est également une conférencière recherchée et une influence majeure dans le monde de l'architecture contemporaine, inspirant de nombreux architectes émergents par sa créativité et son approche visionnaire.",https://upload.wikimedia.org/wikipedia/commons/thumb/a/af/Manuelle_Gautrand_-_C%C3%A9r%C3%A9monie_mondiale_du_Prix_Versailles%2C_27_mai_2016.jpg/1200px-Manuelle_Gautrand_-_C%C3%A9r%C3%A9monie_mondiale_du_Prix_Versailles%2C_27_mai_2016.jpg
