nom_designer,date_naissance,country,description,image
Ruedi Baur,1956,France,"Ruedi Baur est un designer graphique et artiste suisse reconnu internationalement pour son travail novateur dans le domaine du design visuel et de la signalétique. Né en 1956 à Paris, Baur a étudié le graphisme à l'École nationale supérieure des arts décoratifs de Paris.  Il est surtout connu pour ses contributions dans le domaine de la signalétique urbaine et de l'identité visuelle, où il cherche à créer des systèmes de communication efficaces et esthétiquement attrayants pour les espaces publics. Son approche du design est profondément ancrée dans la notion de participation citoyenne et de compréhension culturelle, cherchant à créer des environnements visuels qui favorisent l'inclusion et la diversité.  Parmi les réalisations notables de Baur figurent des projets de signalétique pour des institutions culturelles, des espaces publics et des infrastructures de transport à travers le monde. Son travail combine souvent des éléments de typographie, de couleur, de forme et de matériaux pour créer des systèmes de signalétique cohérents et facilement reconnaissables.  En plus de son travail pratique, Ruedi Baur est également un éducateur et un théoricien du design, ayant enseigné dans plusieurs institutions prestigieuses en Europe et aux États-Unis. Il est l'auteur de plusieurs livres sur le design visuel et a contribué de manière significative à la réflexion sur la place du design dans la société contemporaine.  L'héritage de Ruedi Baur dans le domaine du design graphique et de la signalétique urbaine est indéniable, et son approche innovante continue d'influencer les praticiens du design et les décideurs à travers le monde.",https://accra-recherche.unistra.fr/websites/_processed_/4/8/csm_Ruedi_BAUR_-_Photo_b018c98001.jpg
Téjo Remy,1960,Pays-Bas,"Téjo Remy est un designer néerlandais renommé, connu pour ses créations originales et éclectiques qui défient souvent les conventions du design traditionnel. Né le 4 novembre 1960 à Bois-le-Duc, aux Pays-Bas, Remy a étudié le design industriel à l'Académie de design industriel d'Eindhoven.  Sa carrière a décollé dans les années 1990 avec la création de pièces de mobilier et d'objets utilitaires qui se distinguent par leur approche ludique, éclectique et souvent surréaliste. Remy est célèbre pour son utilisation innovante de matériaux récupérés et recyclés, ainsi que pour sa capacité à transformer des objets du quotidien en pièces uniques et artistiques.  L'une de ses créations les plus emblématiques est la ""Chest of Drawers"" (commode), réalisée en collaboration avec Droog Design en 1991. Cette pièce, qui semble être un assemblage chaotique de tiroirs en bois récupérés, est devenue un symbole de l'esthétique éclectique et de la philosophie du design de Remy.  Au fil des ans, Téjo Remy a continué à produire des œuvres qui défient les attentes et repoussent les limites du design conventionnel. Ses créations ont été exposées dans des musées et des galeries du monde entier, et il a reçu de nombreux prix et distinctions pour son travail novateur.  En plus de son travail en tant que designer, Remy a également enseigné le design dans plusieurs institutions néerlandaises. Son influence dans le monde du design contemporain est indéniable, et son approche éclectique et expérimentale continue d'inspirer de nombreux designers et amateurs d'art à travers le monde.",https://encrypted-tbn0.gstatic.com/images?q=tbn:ANd9GcTcNahsf2bJbBzzGaEZi_Faq7Zj_Twoex6ymlJcGzOvMsPg9AGwljpEEZh_zVWi1B5Oea8&usqp=CAU
Filippo Mambretti,1981,Italie,"Filippo Mambretti est un designer italien qui se distingue par son travail innovant dans le domaine du design industriel et de produit. Né à Milan, en Italie, Mambretti a étudié le design industriel à l'Université Polytechnique de Milan, où il a acquis une solide formation dans les principes du design et de l'ingénierie.  Son approche du design se caractérise par une combinaison de fonctionnalité, d'esthétique et d'innovation. Mambretti est connu pour son souci du détail et sa capacité à créer des produits qui répondent aux besoins des utilisateurs tout en étant esthétiquement attrayants.  Mambretti a travaillé sur une variété de projets allant des meubles et des luminaires aux produits électroniques et aux accessoires de mode. Son portfolio comprend des collaborations avec des marques de renommée mondiale ainsi que des projets indépendants.  En plus de son travail de conception, Mambretti s'intéresse également à l'enseignement et à la recherche dans le domaine du design. Il participe régulièrement à des conférences et des workshops et partage son expertise avec la prochaine génération de designers.  L'approche novatrice et le talent créatif de Filippo Mambretti ont été reconnus par l'industrie du design, et ses créations ont été exposées dans des salons et des expositions à travers le monde. Il continue de repousser les limites du design industriel avec son travail innovant et inspirant.",https://mir-s3-cdn-cf.behance.net/user/276/93adca1850757.6355a483e9f05.jpg
Jasper Morrison,1959,Angleterre,"Jasper Morrison est un designer industriel britannique né le 9 février 1959 à Londres. Il est connu pour son approche minimaliste et fonctionnaliste du design, ainsi que pour sa capacité à créer des produits simples et intemporels.  Morrison a étudié le design à la Kingston Polytechnic Design School à Londres, ainsi qu'à la Royal College of Art, où il a obtenu son diplôme en 1985. Après ses études, il a travaillé brièvement pour le designer anglais Norman Foster, avant de s'établir à son compte en 1986.  Le travail de Morrison couvre une gamme de domaines, y compris le mobilier, l'éclairage, les accessoires de maison, les produits électroniques et les espaces intérieurs. Ses créations se distinguent par leur simplicité élégante, leur fonctionnalité pratique et leur attention aux détails.  Parmi ses créations les plus célèbres, on peut citer la chaise ""Air"" pour Magis, le fauteuil ""Soft Modular Sofa"" pour Vitra, et la lampe ""Glo-Ball"" pour Flos. Ces pièces sont devenues des icônes du design contemporain, appréciées pour leur esthétique épurée et leur confort.  En plus de son travail de conception, Morrison est également un écrivain et un conférencier prolifique sur le design. Il a publié plusieurs livres sur le sujet et a donné des conférences dans le monde entier.  Jasper Morrison a reçu de nombreux prix et distinctions pour son travail, dont le prestigieux Compasso d'Oro en Italie. Son influence dans le domaine du design est indéniable, et ses créations continuent d'inspirer les designers et les amateurs de design du monde entier.",https://static.vitra.com/media-resized/D2K4qYqT2a_h7E5xQNlKBlsIAlpe7xrsyvMz3yd1e4c/fill/600/600/ce/0/aHR0cHM6Ly9zdGF0aWMudml0cmEuY29tL21lZGlhL2Fzc2V0LzE5OTM2NTkvc3RvcmFnZS92X2Z1bGxibGVlZF8xNDQweC8yOTUxMzE5MS5qcGc.jpg
Gavin Munro,1983,Angleterre,"Gavin Munro est un designer et entrepreneur britannique connu pour son travail novateur dans le domaine du design de mobilier. Il est le fondateur de ""Full Grown"", une entreprise qui cultive des arbres pour les façonner en meubles et en objets d'art.  L'approche de Munro est basée sur le principe de la croissance dirigée, où il guide la croissance des arbres depuis de jeunes pousses jusqu'à maturité en les façonnant à l'aide de moules et de cadres. Ce processus permet de créer des pièces de mobilier uniques et entièrement naturelles, en éliminant le besoin de couper des arbres pour fabriquer du bois d'œuvre.  Les meubles cultivés par Gavin Munro et son équipe comprennent des chaises, des tables, des lampes et d'autres objets, tous fabriqués à partir de bois d'arbres vivants. Cette approche durable et écologique du design mobilier a attiré l'attention à l'échelle mondiale et a été saluée pour son engagement envers la durabilité environnementale.  En plus de son travail avec Full Grown, Gavin Munro est un conférencier et un défenseur de la durabilité et de l'innovation dans le design. Son approche unique du design mobilier continue d'inspirer les designers et les amoureux de la nature à travers le monde.",https://i2.wp.com/creapills.com/wp-content/uploads/2019/09/gavin-munro-designer-chaises-arbres.jpg?fit=1024%2C682&ssl=1
Noaoto Fukasawa,1956,Japon,"Naoto Fukasawa est un designer industriel japonais de renom, né le 6 août 1956 à Yamanashi, au Japon. Il est célèbre pour son approche minimaliste et fonctionnaliste du design, axée sur la simplicité, la sobriété et la compréhension intuitive des besoins des utilisateurs.  Fukasawa a étudié l'art et le design à l'Université Tama Art de Tokyo, où il a obtenu son diplôme en 1980. Par la suite, il a travaillé chez Seiko Epson Corporation et chez Idée Ltd., où il a été l'un des membres fondateurs du célèbre studio de design IDEO à Tokyo.  Au fil des ans, Fukasawa a collaboré avec de nombreuses entreprises renommées à travers le monde, notamment Muji, Herman Miller, B&B Italia, Alessi et Panasonic. Ses créations comprennent une large gamme de produits, des électroménagers et des meubles aux montres et aux articles de papeterie.  Parmi ses œuvres les plus emblématiques, on peut citer le téléphone portable Infobar pour au KDDI, la série de chaises Hiroshima pour Maruni, et la gamme de produits de cuisine pour Alessi. Ces créations sont saluées pour leur esthétique épurée, leur fonctionnalité intuitive et leur capacité à s'intégrer harmonieusement dans différents environnements.  Fukasawa est également un conférencier et un écrivain prolifique sur le design. Il a publié plusieurs livres sur le sujet, notamment ""Naoto Fukasawa"" et ""Supernormal"", qui explorent sa philosophie du design et son approche de la conception de produits simples et significatifs.  Son travail a été largement exposé dans des musées et des galeries du monde entier, et il a reçu de nombreux prix et distinctions pour sa contribution au design industriel. Naoto Fukasawa continue d'être une figure influente dans le domaine du design contemporain, inspirant les designers et les entreprises à adopter une approche plus sensible et empathique du design.",https://luminaire.com/cdn/shop/articles/NaotoFukasawa_Large_273282d8-2681-43f3-b67b-ef3f5f425be4.jpg?v=1617808392
Gae Aulenti,1927-2012,Italie,"Gae Aulenti était une architecte et designer italienne renommée, née le 4 décembre 1927 à Palazzolo dello Stella, en Italie, et décédée le 31 octobre 2012 à Milan. Elle est surtout connue pour son travail dans le domaine de l'architecture d'intérieur et du design industriel.  Aulenti a étudié l'architecture à l'École polytechnique de Milan, où elle a obtenu son diplôme en 1954. Elle a rapidement acquis une réputation pour son approche innovante du design, qui combinait fonctionnalité et esthétique de manière créative.  Pendant sa carrière, Aulenti a travaillé sur une variété de projets, y compris des musées, des théâtres, des magasins et des espaces publics. Elle est notamment connue pour avoir rénové la gare d'Orsay à Paris, transformant l'ancienne gare en un musée d'art, le Musée d'Orsay, en 1986. Cette réalisation a été saluée pour sa capacité à combiner le patrimoine historique avec une esthétique contemporaine.  En tant que designer industriel, Aulenti a créé des meubles et des luminaires emblématiques, dont certains sont devenus des classiques du design. Parmi ses œuvres les plus célèbres, on peut citer la lampe ""Pipistrello"" pour Martinelli Luce et le fauteuil ""Locus Solus"" pour Poltronova.  Tout au long de sa carrière, Gae Aulenti a reçu de nombreux prix et distinctions pour son travail, notamment le prestigieux Praemium Imperiale pour l'architecture en 1991. Son héritage dans le domaine du design et de l'architecture continue d'être célébré et son influence se fait sentir dans de nombreux domaines de la culture contemporaine.",https://hips.hearstapps.com/hmg-prod/images/02-arch-gae-aulenti-in-studio-1991-foto-archivio-gae-aulenti-1600182701.jpg
Konstantin Grcic,1965,Allemagne,"Konstantin Grcic est un designer industriel renommé, né le 9 novembre 1965 à Munich, en Allemagne. Il est célèbre pour son approche innovante et expérimentale du design, ainsi que pour ses créations qui combinent fonctionnalité, esthétique et matériaux de manière originale.  Grcic a étudié le design industriel à la Royal College of Art de Londres, où il a obtenu son diplôme en 1990. Après ses études, il a travaillé comme assistant de Jasper Morrison, un autre designer de renom, avant de fonder son propre studio de design à Munich en 1991.  Au cours de sa carrière, Grcic a travaillé sur une variété de projets, allant du mobilier et de l'éclairage aux produits électroniques et aux accessoires de mode. Ses créations se caractérisent par leur simplicité épurée, leur fonctionnalité intelligente et leur esthétique contemporaine.  Parmi ses œuvres les plus célèbres, on peut citer la chaise ""Chair_One"" pour Magis, la lampe ""Mayday"" pour Flos et la série de meubles ""Miura"" pour Plank. Ces créations ont été saluées pour leur design innovant et ont remporté de nombreux prix et distinctions internationaux.  En plus de son travail de conception, Konstantin Grcic est également un conférencier et un écrivain prolifique sur le design. Il a donné des conférences dans le monde entier et a publié plusieurs livres sur le sujet, explorant des thèmes tels que la fonctionnalité, l'esthétique et l'innovation dans le design contemporain.  L'influence de Konstantin Grcic dans le domaine du design industriel est indéniable, et ses créations continuent d'inspirer les designers et les amateurs de design du monde entier.",https://www.magisdesign.com/wp-content/uploads/2015/01/Konstantin_Grcic.jpg
Frère Bouroullec,1971 / 1976,France,"Ronan et Erwan Bouroullec sont deux frères designers français, nés respectivement en 1971 et 1976 à Quimper, en Bretagne. Ils sont reconnus pour leur collaboration fructueuse dans le domaine du design produit, du mobilier, de l'architecture d'intérieur et des installations artistiques.  Les frères Bouroullec ont étudié tous les deux à l'École nationale supérieure des arts décoratifs (ENSAD) de Paris et à l'École nationale supérieure des arts appliqués (ENSAAMA). Leur collaboration a débuté dans les années 1990 alors qu'ils travaillaient ensemble dans le studio du designer français, François Seigneur.  Leur approche du design se caractérise par une esthétique épurée, des lignes organiques et une recherche constante d'innovation technique. Ils explorent une grande variété de matériaux et de techniques de fabrication pour créer des pièces qui sont à la fois fonctionnelles et poétiques.  Parmi leurs réalisations les plus célèbres, on peut citer le système de bibliothèque ""Clouds"" pour Kvadrat, la chaise ""Vegetal"" pour Vitra, le canapé ""Alcove"" pour Vitra, et la collection de luminaires ""Piani"" pour Flos.  Leur travail a été largement exposé dans des musées et des galeries du monde entier, et ils ont reçu de nombreux prix et distinctions pour leur contribution au design contemporain. Les frères Bouroullec continuent d'être une force majeure dans le monde du design, apportant leur vision unique et leur sensibilité artistique à une grande variété de projets à travers le monde.",https://static.vitra.com/media-resized/5heIo13k8kTQlqSImdEvqXRsrJosen_ysJ92ODdwCWs/fill/1040/1390/ce/0/aHR0cHM6Ly9zdGF0aWMudml0cmEuY29tL21lZGlhL2Fzc2V0LzE1NDkyNTAvc3RvcmFnZS92X2Z1bGxibGVlZF8xNDQweC8xNjg2NDU1OC5qcGc.jpg
Samy Rio,1989,France,"Samy Rio est un designer français dont le travail se situe à l'intersection du design de produit et de la recherche artistique. Né en 1984, il est diplômé de l'école Boulle à Paris en design de mobilier.  Le travail de Rio se distingue par son exploration des matériaux naturels et son engagement envers des processus de fabrication durables et responsables. Il cherche souvent à créer des objets qui évoquent un lien profond avec la nature et qui reflètent une esthétique organique et intemporelle.  Rio puise son inspiration dans la nature, les paysages et les matériaux locaux, et il attache une grande importance à la relation entre l'homme et son environnement. Son approche du design est imprégnée de simplicité, d'harmonie et de respect pour les ressources naturelles.  Parmi ses réalisations les plus remarquables, on trouve une série de meubles en bois massif, des luminaires inspirés de la nature et des objets d'artisanat qui célèbrent le savoir-faire traditionnel.  En plus de son travail de conception, Samy Rio est également un enseignant et un conférencier. Il partage régulièrement son expertise avec les étudiants et les professionnels du design, et il participe à des conférences et des workshops à travers le monde.  L'approche authentique et éthique de Samy Rio en fait l'une des figures émergentes les plus intéressantes dans le domaine du design contemporain, et son travail continue d'inspirer les autres à repenser notre relation avec le monde naturel à travers le design.",https://www.boisbuchet.org/wp-content/uploads/2020/02/2023-Samy-Rio-portrait2.jpg
Herzog & de Meuron,1978,Suisse,"Herzog & de Meuron est un cabinet d'architecture suisse fondé en 1978 par Jacques Herzog et Pierre de Meuron, tous deux nés en Suisse en 1950. Leur pratique est devenue l'une des plus influentes et respectées dans le monde de l'architecture contemporaine.  La philosophie de Herzog & de Meuron repose sur une approche contextuelle et expérimentale, où chaque projet est conçu en réponse aux spécificités du site, aux besoins du client et aux défis environnementaux. Leur travail se caractérise par une recherche constante d'innovation et une exploration approfondie des matériaux, des formes et des techniques de construction.  Parmi leurs projets les plus célèbres, on trouve le Tate Modern à Londres, la Allianz Arena à Munich, le Stade National de Pékin (surnommé le ""Nid d'oiseau"") pour les Jeux olympiques d'été de 2008, et la Elbphilharmonie à Hambourg. Ces réalisations emblématiques ont été saluées pour leur impact architectural et leur contribution à la scène culturelle mondiale.  Le travail de Herzog & de Meuron s'étend également au-delà de l'architecture traditionnelle pour inclure des projets dans les domaines de l'urbanisme, du design d'intérieur, du mobilier et même du design de produits. Ils ont également remporté de nombreux prix et distinctions prestigieux, dont le Prix Pritzker en 2001, considéré comme le plus prestigieux prix d'architecture au monde.  L'héritage de Herzog & de Meuron dans le domaine de l'architecture contemporaine est indéniable, et leur influence se fait sentir dans le monde entier. Leur approche novatrice et leur engagement envers l'excellence architecturale continuent d'inspirer les architectes et les urbanistes à repousser les limites de la conception et de la construction.",https://www.artemide.com/contents/immagini/designer/4865619-960x960.jpg
Patrick Join,1967,France,"Patrick Jouin est un designer français renommé, né en 1967 à Nantes. Il est reconnu pour son travail dans les domaines du mobilier, du design industriel, de l'architecture d'intérieur et de la conception de produits.   Jouin a étudié à l'École nationale supérieure de création industrielle (ENSCI) à Paris, où il a obtenu son diplôme en design industriel en 1992. Il a ensuite travaillé avec le designer Philippe Starck pendant plusieurs années, ce qui lui a permis d'acquérir une expérience précieuse dans le domaine du design.  En 1999, Jouin a fondé son propre studio de design, Patrick Jouin ID, basé à Paris. Depuis lors, il a collaboré avec de nombreuses marques prestigieuses telles que Kartell, Alessi, Cassina, Roche Bobois, Ligne Roset et Kartell, pour ne citer que quelques exemples.   Son approche du design se caractérise par son attention aux détails, son exploration des matériaux innovants et sa capacité à créer des pièces à la fois fonctionnelles et esthétiquement attrayantes. Il est connu pour ses designs élégants et contemporains, qui allient souvent des formes organiques avec une esthétique moderne.  Parmi ses réalisations les plus célèbres, on peut citer le fauteuil ""Solid"" pour Kartell, la chaise ""One Shot"" pour MGX by Materialise, et la collection de luminaires ""Bloom"" pour MGX. Ces créations ont été largement exposées dans des musées et des galeries à travers le monde et ont remporté de nombreux prix et distinctions prestigieux.  En plus de son travail de conception, Patrick Jouin enseigne également le design industriel à l'École nationale supérieure des arts décoratifs (ENSAD) à Paris. Son influence dans le domaine du design contemporain est indéniable, et son travail continue d'inspirer les designers et les amateurs de design du monde entier.",https://resize.elle.fr/portrait/var/plain_site/storage/images/personnalites/patrick-jouin/12167861-5-fre-FR/Patrick-Jouin.jpg
Marc Newson,1963,Australie,"Marc Newson est un designer industriel et un architecte d'intérieur australien, né le 20 octobre 1963 à Sydney. Il est connu pour son style distinctif et futuriste, ainsi que pour sa capacité à créer des objets uniques et innovants dans une variété de domaines, notamment le mobilier, les produits de consommation, les transports et l'architecture.  Newson a étudié la sculpture et le design de bijoux à la Sydney College of the Arts, puis a poursuivi ses études en design à l'École de design de Sydney. Son travail a rapidement attiré l'attention pour son esthétique organique et futuriste, ainsi que pour son utilisation innovante des matériaux et des technologies de fabrication.  Parmi ses œuvres les plus célèbres, on trouve la chaise ""Embryo"" (1988), la ""Lockheed Lounge"" (1986), et le ""Orgone Chair"" (1993). Ces pièces emblématiques ont été acclamées pour leur originalité et leur audace, et sont devenues des symboles du design contemporain.  En plus de son travail de conception, Marc Newson a également collaboré avec de nombreuses grandes marques et entreprises, notamment Apple, Nike, Louis Vuitton et Ford. Il a également travaillé sur des projets architecturaux, dont le Qantas First Lounge à l'aéroport international de Sydney.  Tout au long de sa carrière, Newson a reçu de nombreux prix et distinctions pour son travail, dont le prestigieux Design Award du Design Museum de Londres en 2014. Son influence dans le monde du design est indéniable, et son travail continue d'inspirer les designers et les amateurs de design du monde entier.",https://upload.wikimedia.org/wikipedia/commons/e/e0/Marc_Newson.jpg
Joana Vasconcelos,1971,Portugal,"Joana Vasconcelos est une artiste contemporaine portugaise née le 11 janvier 1971 à Paris, en France. Elle est connue pour son œuvre multidisciplinaire qui explore des thèmes tels que l'identité, le genre, la culture populaire et les traditions portugaises.  Vasconcelos utilise une grande variété de matériaux dans ses créations, allant des textiles et de la céramique aux objets du quotidien et aux éléments de récupération. Elle est particulièrement célèbre pour ses sculptures monumentales et ses installations audacieuses qui combinent souvent des éléments traditionnels avec des éléments contemporains.  L'une de ses œuvres les plus célèbres est ""The Bride"" (2001-2005), une sculpture en crochet géante qui représente une robe de mariée suspendue dans l'air. Cette pièce a été exposée dans de nombreux musées à travers le monde et a contribué à faire connaître le travail de Vasconcelos à l'échelle internationale.  En plus de ses installations artistiques, Vasconcelos crée également des œuvres plus petites, notamment des sculptures, des peintures et des œuvres sur papier. Son travail est souvent humoristique et provocateur, remettant en question les normes sociales et explorant les notions de beauté, de pouvoir et de consommation.  Au fil des ans, Joana Vasconcelos a reçu de nombreux prix et distinctions pour son travail, et ses œuvres font partie de collections de musées renommés à travers le monde. Elle continue d'être une figure importante dans le monde de l'art contemporain, repoussant les frontières de la pratique artistique et inspirant les générations futures d'artistes.",https://encrypted-tbn0.gstatic.com/images?q=tbn:ANd9GcSbb04shECHuKCh2yvbgwDpPDAivPKRVT9pv9R-dwX6N1ka2Cct62GaKhLSPj_Zz4Fp-0o&usqp=CAU
