nom_designer,date_naissance,country,description,image
Philippe Starck,1949,France,"Philippe Starck est un designer français emblématique, né le 18 janvier 1949 à Paris. Il est réputé pour son approche avant-gardiste et son style éclectique qui ont marqué le design industriel et la conception d'objets du quotidien depuis les années 1980.  Starck a travaillé dans divers domaines du design, notamment le mobilier, l'architecture d'intérieur, les produits de consommation, les objets domestiques et même les projets d'architecture. Il a collaboré avec de nombreuses grandes marques et entreprises à travers le monde.  Ce qui distingue le travail de Starck, c'est son attention particulière aux détails, son utilisation innovante des matériaux et sa capacité à réinventer les formes traditionnelles. Il est également connu pour son engagement en faveur du développement durable et de la conception éthique, en cherchant à créer des produits qui soient à la fois esthétiques et respectueux de l'environnement.  Certains de ses designs les plus célèbres incluent des chaises comme la ""Louis Ghost Chair"" pour Kartell, des lampes comme la ""Miss K"" pour Flos, des hôtels comme le Royalton à New York et le Delano à Miami, ainsi que des produits grand public comme les presse-agrumes ""Juicy Salif"" pour Alessi.  Son travail a eu un impact majeur sur le monde du design, influençant de nombreux créateurs et repoussant les limites de ce qui est considéré comme conventionnel dans le domaine.",https://www.starck.fr/00DATA/cms/news/wallpaper-design-award/031-philippe-starck.jpg
Ólafur Elíasson,1967,Danemark,"Ólafur Elíasson est un artiste contemporain danois-islandais né le 5 février 1967 à Copenhague, au Danemark. Il est connu pour ses installations artistiques immersives qui explorent la perception, la lumière, la couleur et l'environnement. Son travail interroge souvent la relation entre l'homme et son environnement naturel, ainsi que les notions de perception et de réalité.  Elíasson utilise une variété de médiums, notamment la sculpture, la photographie, la vidéo et l'installation pour créer des expériences sensorielles et conceptuelles uniques. Ses installations souvent monumentales ont été exposées dans le monde entier, dans des musées, des galeries d'art et des espaces publics.  L'une de ses œuvres les plus emblématiques est ""The Weather Project"", une installation présentée à la Tate Modern de Londres en 2003. Cette œuvre utilisait des lampes et des miroirs pour recréer un soleil artificiel dans la Turbine Hall de la Tate, créant une atmosphère éthérée où les visiteurs pouvaient se sentir immergés dans une simulation de coucher de soleil.  Elíasson est également connu pour son engagement envers les questions environnementales et sociales. Il a co-fondé le studio de design et d'innovation sociale Studio Other Spaces, où il travaille sur des projets visant à sensibiliser aux défis environnementaux et sociaux contemporains.  En plus de son travail artistique, Elíasson est également un conférencier et un enseignant renommé, partageant ses idées sur l'art, la perception et l'environnement avec un public plus large.  Son travail stimulant et engagé a fait de lui l'un des artistes contemporains les plus influents et les plus respectés de sa génération.",https://encrypted-tbn0.gstatic.com/images?q=tbn:ANd9GcQrrvBOWW7eVnu7ukOtTrrsIBA5ge3Y__3NKg&usqp=CAU
Iris van Herpen,1984,Pays-Bas,"Iris van Herpen est une créatrice de mode néerlandaise née le 5 juin 1984 à Wamel, aux Pays-Bas. Elle est célèbre pour son approche avant-gardiste de la mode, combinant la technologie, l'art et la couture pour créer des pièces spectaculaires et innovantes.  Van Herpen a étudié à l'Académie royale des beaux-arts de La Haye, où elle a obtenu son diplôme en design de mode en 2006. Après avoir travaillé avec Alexander McQueen à Londres et avec Claudy Jongstra aux Pays-Bas, elle a lancé sa propre maison de couture en 2007.  Son travail se distingue par son exploration des nouvelles technologies et des matériaux novateurs. Elle utilise des techniques de pointe telles que l'impression 3D, le laser et la découpe au laser pour créer des vêtements qui repoussent les limites de la couture traditionnelle. Ses créations sont souvent caractérisées par des formes organiques, des textures complexes et une esthétique futuriste.  Van Herpen est également connue pour ses collaborations avec d'autres artistes et créateurs, notamment le sculpteur Jolan van der Wiel, le photographe Nick Knight et le musicien Björk. Ses collections ont été présentées lors de défilés de mode prestigieux à travers le monde, et ses créations ont été portées par des célébrités telles que Lady Gaga, Björk et Beyoncé.  En plus de son travail dans le monde de la mode, Iris van Herpen est reconnue pour sa vision artistique unique et son exploration des intersections entre la mode, la technologie et l'art. Ses créations continuent d'inspirer et de fasciner les amateurs de mode et les artistes du monde entier.",https://img.lemde.fr/2023/12/04/0/0/4912/6549/664/0/75/0/9752466_1701690692397-robin-de-puy.jpg
Tadao Andō,1981,Japon,"Tadao Andō est un architecte japonais renommé, né le 13 septembre 1941 à Osaka, au Japon. Il est célèbre pour son approche minimaliste et sa maîtrise de l'utilisation du béton dans ses œuvres architecturales.  Andō n'a pas suivi de formation d'architecte traditionnelle, mais a plutôt été autodidacte, s'inspirant de ses voyages et de ses lectures pour développer sa propre philosophie architecturale. Son travail est profondément influencé par la culture japonaise, mais il intègre également des éléments de modernisme et de minimalisme occidental.  Ses bâtiments se caractérisent par des formes géométriques simples, des lignes épurées et l'utilisation réfléchie de la lumière naturelle. Il est particulièrement connu pour ses espaces contemplatifs et méditatifs, comme le Temple de l'Eau à Awaji, au Japon, et la Chiesa sull'acqua à Milan, en Italie.  Parmi ses œuvres les plus célèbres, on trouve le Musée d'art moderne de Fort Worth au Texas, la Fondation pour l'art contemporain François Pinault à Venise, et la célèbre Église de la Lumière à Osaka. Andō a reçu de nombreux prix prestigieux pour son travail, dont le prix Pritzker, considéré comme le plus grand honneur dans le domaine de l'architecture, en 1995.  Son approche de l'architecture, qui combine simplicité, fonctionnalité et spiritualité, continue d'influencer les architectes du monde entier.",https://www.pinaultcollection.com/sites/default/files/styles/main_big/public/2019-12/2018-10-09_Courtesy%20Bourse%20de%20Commerce%20Collection%20Pinault%20-%20Paris%20Photo%20Maxime%20Te%CC%81tard%20Studio%20Les%20Graphiquants%20Paris_droits%20leve%CC%81s%20%285%29_0.jpg?itok=qLk4KcVu
Michael Bierut,1957,Etats-Unis,"Michael Bierut est un designer graphique renommé, reconnu pour son travail exceptionnel dans le domaine du design de marque, de l'identité visuelle et de la typographie. Né en 1957, il a étudié à l'Université de Cincinnati's College of Design, Architecture, Art, and Planning (DAAP) où il a obtenu son diplôme en design graphique en 1980.  Bierut a acquis une renommée internationale en tant que partenaire de Pentagram, l'une des plus prestigieuses agences de design au monde, où il a travaillé depuis les années 1990. Il est basé dans le bureau de Pentagram à New York.  Son travail est varié et influent, allant de la conception de logos emblématiques pour des marques telles que Mastercard, Verizon, et le New York Times, à la conception d'identités visuelles pour des institutions culturelles comme le Brooklyn Academy of Music et le Musée des Beaux-Arts de Philadelphie.  Bierut est également un conférencier éloquent et un écrivain prolifique sur le design. Il partage généreusement son expertise à travers des conférences, des articles et des livres, offrant des perspectives uniques sur la pratique du design et sur l'impact du design dans la société contemporaine.  Sa carrière exemplaire, marquée par une combinaison de créativité, de rigueur conceptuelle et d'engagement envers l'excellence, fait de Michael Bierut une figure vénérée et influente dans le monde du design graphique.",https://thegreatdiscontent.com/wp-content/uploads/2021/10/michael-bierut-hero-jake-chessum.jpg
Kenzo Takada,1939,Japon,"Kenzo Takada était un créateur de mode japonais renommé, connu pour avoir fondé la marque de mode Kenzo. Né le 27 février 1939 à Himeji, au Japon, il a déménagé à Paris en 1965 pour poursuivre ses études en design de mode à l'école de la Chambre Syndicale de la Couture Parisienne.  En 1970, Takada a ouvert sa première boutique de mode à Paris, qu'il a appelée ""Jungle Jap"". Cette boutique a été renommée ""Kenzo"" par la suite, et elle est rapidement devenue célèbre pour ses créations audacieuses et colorées, inspirées par des motifs ethniques et floraux. Ses designs innovants ont contribué à changer le paysage de la mode dans les années 1970 et ont attiré une clientèle internationale.  Kenzo Takada était reconnu pour sa capacité à mélanger des éléments de l'Orient et de l'Occident dans ses collections, créant ainsi un style unique et avant-gardiste. Ses vêtements étaient caractérisés par des coupes fluides, des imprimés vivants et une utilisation audacieuse de la couleur.  En plus de ses créations de mode, Kenzo Takada s'est également aventuré dans d'autres domaines artistiques, notamment la décoration intérieure et la parfumerie. Sa marque a continué de prospérer sous sa direction jusqu'à ce qu'il vende Kenzo à LVMH en 1993.  Malheureusement, Kenzo Takada est décédé le 4 octobre 2020 à l'âge de 81 ans des suites de complications liées au COVID-19. Son héritage dans le monde de la mode perdure, et il est largement salué pour avoir apporté une vision fraîche et novatrice à l'industrie de la mode internationale.",https://encrypted-tbn0.gstatic.com/images?q=tbn:ANd9GcSa3_lShVzgdPk7bRZYCymRuleZMLrvrE_X4wMFDh-1vr77lnqC7s4b-m3NtkQ0koz7ulI&usqp=CAU
Toyō Itō,1941,Japon,"Toyō Itō est un architecte japonais de renom, reconnu pour son approche innovante et expérimentale du design architectural. Né le 1er juin 1941 à Séoul, en Corée du Sud (alors sous domination japonaise), Itō a étudié l'architecture à l'Université de Tokyo, où il a obtenu son diplôme en 1965.  Itō a commencé sa carrière en travaillant pour l'architecte Kiyonori Kikutake, un membre éminent du mouvement métaboliste japonais, qui a influencé profondément sa vision architecturale. Plus tard, il a fondé son propre cabinet d'architecture, Urban Robot (Urbot), qui a ensuite été renommé Toyō Itō & Associates en 1971.  L'œuvre de Itō se caractérise par une exploration constante de la relation entre l'architecture, la nature et la technologie. Il est célèbre pour ses conceptions organiques et fluides qui intègrent souvent des éléments de la nature et qui cherchent à créer des espaces où l'intérieur et l'extérieur se fondent harmonieusement.  Parmi ses réalisations les plus célèbres, on peut citer le Musée d'Art contemporain de Tokyo (1995), la Sendai Mediatheque (2001), et la Tōhoku University's Medal Plaza (1997). Sa conception du Stade national du Japon pour les Jeux olympiques d'été de 2020 à Tokyo était également très attendue avant le report des Jeux.  En 2013, Toyō Itō a reçu le prix Pritzker, la plus haute distinction en architecture, pour l'ensemble de son œuvre novatrice et influente. Il continue à être une figure majeure dans le monde de l'architecture contemporaine, inspirant les architectes du monde entier par sa créativité et son engagement envers l'exploration de nouvelles possibilités dans le domaine architectural.",https://i.guim.co.uk/img/static/sys-images/Guardian/Pix/pictures/2013/3/18/1363633515323/Toyo-Ito-008.jpg?width=465&dpr=1&s=none
Viktor & Rolf,1969,Pays-Bas,"Viktor Horsting et Rolf Snoeren, mieux connus sous le nom de Viktor & Rolf, sont un duo de designers de mode néerlandais célèbre pour leur approche artistique et expérimentale de la mode. Ils ont tous deux étudié à l'Académie royale des beaux-arts d'Anvers, où ils se sont rencontrés et ont commencé à collaborer.  Ils ont fondé leur maison de couture Viktor & Rolf en 1993 à Amsterdam. Leur style distinctif se caractérise par des éléments de haute couture associés à des concepts artistiques et souvent conceptuels. Ils sont réputés pour leurs collections avant-gardistes qui repoussent les limites de la mode et de l'art.  L'un des premiers grands succès de Viktor & Rolf a été leur collection de 1999 intitulée ""Russian Doll"", où ils ont présenté des mannequins portant des couches de vêtements empilés les uns sur les autres, créant ainsi un effet de poupée russe. Cette collection a attiré l'attention internationale et a établi leur réputation en tant que pionniers de la mode conceptuelle.  Le duo est également connu pour ses collaborations avec des marques de renom telles que H&M et Swarovski, ainsi que pour ses créations de costumes pour des productions théâtrales et des performances artistiques.  En plus de la haute couture, Viktor & Rolf ont étendu leur empreinte dans l'industrie de la mode avec des lignes de prêt-à-porter, des accessoires, des parfums et d'autres produits. Leur vision artistique et leur ingéniosité les ont placés au sommet de l'industrie de la mode, faisant d'eux des figures emblématiques et respectées dans le monde de la création.",https://mobile-img.lpcdn.ca/lpca/924x/r3996/f6640eaa-5469-11ea-afe4-0221ff56c947.jpg
François Azambourg,1963,France,"François Azambourg est un designer français dont le travail explore le potentiel expressif des procédés de fabrication et de mise en forme des matériaux, qu'ils soient industriels ou artisanaux, novateurs ou traditionnels. Issu d'une formation en électrotechnique, puis aux Beaux-Arts et à l'ENSAAMA Olivier de Serres, il a développé une pratique centrée sur l'alliance des techniques et de l'art, dans un souci constant d'économie de moyens et de légèreté.  Il est représenté par plusieurs institutions et éditeurs renommés, dont AA New Design, Bernard Chauveau Éditions, Cappellini, Cinna, Hermès, Ligne Roset, Moustache, et bien d'autres. Son travail comprend la création de mobilier, de luminaires, de scénographies et décors de théâtre, ainsi que des aménagements urbains et d'intérieurs pour des municipalités, hôtels et particuliers.  François Azambourg a été récompensé par plusieurs prix et distinctions tout au long de sa carrière, notamment le Grand Prix du Design de Paris en 2004, la Villa Médicis hors les Murs en 2003, et le Prix de la Vocation de la Fondation Marcel Bleustein-Blanchet en 1993. Son travail a également été exposé dans de nombreuses institutions prestigieuses à travers le monde, telles que le Musée des Arts décoratifs, la Villa Noailles et le Centre Pompidou.  En tant qu'éducateur, François Azambourg partage son expérience et son approche du design depuis plus de 20 ans, enseignant à l'École Boulle, à Camondo (les Arts Décoratifs), et actuellement à l'ENSCI - les Ateliers. Son influence s'étend donc au-delà de ses créations, contribuant à façonner la prochaine génération de designers.",https://ideat.fr/wp-content/uploads/sites/3/2021/01/franccca7ois-azambourg_ideat-scaled.jpg
Christian Boltanski,1944,France,"Christian Boltanski était un artiste français de renom, principalement connu pour ses installations, sculptures, photographies et films, qui explorent des thèmes profonds tels que la mémoire, l'identité individuelle et collective, la mortalité et l'histoire. Né le 6 septembre 1944 à Paris, il a grandi dans une famille d'origine juive russe.  Son travail est souvent marqué par une esthétique sombre et émouvante, et il utilise fréquemment des éléments tels que les photographies, les vêtements, les boîtes en métal et les enregistrements sonores pour créer des œuvres qui suscitent une réflexion profonde sur la condition humaine.  Boltanski est particulièrement célèbre pour ses installations monumentales, telles que ""Les Archives du Coeur"", où il a collecté les battements de cœur de personnes du monde entier et les a enregistrés sur des disques vinyle. Ses œuvres sont souvent présentées dans des espaces muséaux prestigieux à travers le monde, et il a participé à de nombreuses expositions internationales, dont la Biennale de Venise et documenta.  Au-delà de son travail artistique, Boltanski était également un écrivain prolifique, et il a publié plusieurs livres explorant ses idées et son processus créatif.  Christian Boltanski est décédé le 14 juillet 2021, laissant derrière lui un héritage artistique significatif qui continue d'influencer et de fasciner les générations futures.",https://www.liberation.fr/resizer/aFsa3V_kmtcZMuZlHvjosyCTXkk=/1440x0/filters:format(jpg):quality(70)/cloudfront-eu-central-1.images.arcpublishing.com/liberation/D4LRAXKV45EDVNOZNTYGRW3ZJU.jpg
Anette Messager,1943,France,"Annette Messager est une artiste française contemporaine née le 30 novembre 1943 à Berck-sur-Mer, dans le nord de la France. Elle est surtout connue pour son travail dans les domaines de la sculpture, de l'installation, de la photographie et de l'assemblage. Messager est reconnue pour son approche multidisciplinaire qui explore des thèmes tels que l'identité, le genre, la mémoire et la perception.  Son œuvre est souvent caractérisée par l'utilisation de matériaux simples et quotidiens, ainsi que par l'exploration des idées de domesticité et de féminité. Elle utilise fréquemment des objets trouvés, des textiles et des photographies dans ses créations, créant ainsi des œuvres à la fois intimes et provocantes.  Messager a été récompensée par de nombreux prix prestigieux au cours de sa carrière, dont le Lion d'Or à la Biennale de Venise en 2005. Ses œuvres ont été exposées dans des institutions majeures du monde entier, notamment au Centre Pompidou à Paris, au MoMA à New York et à la Tate Gallery à Londres.  Son travail a eu une influence significative sur l'art contemporain français et international, et elle est largement considérée comme l'une des artistes les plus importantes de sa génération. Sa capacité à repousser les limites de la forme et du contenu artistiques tout en abordant des questions sociales et politiques importantes lui a valu une reconnaissance et une admiration continues dans le monde de l'art contemporain.",https://upload.wikimedia.org/wikipedia/commons/f/f3/Annette_Messager_-_2017_%28cropped%29.jpg
Banksy,1974,Angleterre,"Banksy est un artiste de rue britannique célèbre pour son art urbain provocateur, politiquement chargé et souvent humoristique. Le mystère qui entoure son identité, qu'il garde soigneusement secrète, a contribué à accroître sa renommée mondiale. On pense qu'il est né à Bristol, en Angleterre, autour de la fin des années 1970 ou au début des années 1980.  L'art de Banksy utilise souvent des pochoirs pour créer des images percutantes sur les murs des villes du monde entier. Ses œuvres abordent des sujets tels que la politique, la société de consommation, la guerre, les droits de l'homme et l'environnement. Ses interventions artistiques sont souvent satiriques, provocatrices et chargées de commentaires sociaux, incitant à la réflexion et à la remise en question des normes établies.  Parmi ses œuvres les plus célèbres, on trouve ""Girl with a Balloon"", qui a été récemment partiellement détruite lors d'une vente aux enchères et renommée ""Love is in the Bin"". Banksy est également connu pour des installations spectaculaires et des performances artistiques, comme la création d'un parc d'attractions éphémère appelé ""Dismaland"" en 2015.  Malgré sa notoriété mondiale, Banksy a réussi à maintenir son anonymat, ce qui a suscité de nombreuses spéculations sur son identité réelle. Sa popularité a également attiré l'attention des médias, des collectionneurs d'art et du grand public, faisant de lui l'une des figures les plus emblématiques de l'art urbain contemporain.",https://www.indy100.com/media-library/only-footage-of-banksy-s-face-resurfaces-online.jpg?id=32121605&width=1245&height=700&quality=85&coordinates=0%2C0%2C0%2C0
Christo et Jeanne Claude,1935-2020 / 1935-2009,Buglarie / Maroc,"Christo et Jeanne-Claude étaient un duo d'artistes mariés, connus pour leurs projets d'art environnemental et leurs installations monumentales qui ont captivé le monde entier. Christo Vladimirov Javacheff, né le 13 juin 1935 à Gabrovo, en Bulgarie, et décédé le 31 mai 2020 à New York, était l'artiste visuel principal, tandis que Jeanne-Claude Denat de Guillebon, née le 13 juin 1935 à Casablanca, au Maroc, et décédée le 18 novembre 2009 à New York, était sa collaboratrice et sa compagne.  Leur travail consistait à emballer des structures emblématiques et des paysages naturels avec des tissus colorés, créant ainsi des œuvres éphémères qui transformaient temporairement l'environnement. Parmi leurs projets les plus célèbres, on trouve l'emballage du Pont-Neuf à Paris en 1985, la réalisation du ""Running Fence"" en Californie en 1976, et l'installation de ""The Gates"" à Central Park à New York en 2005.  Leur approche collaborative et leur persévérance à surmonter les obstacles bureaucratiques et techniques ont été saluées dans le monde entier. Leur travail était souvent controversé, mais il a également suscité un vif intérêt et une profonde admiration pour la façon dont ils ont transformé des lieux familiers en œuvres d'art éphémères et spectaculaires.  Après la mort de Jeanne-Claude en 2009, Christo a continué à réaliser des projets en son honneur, avant de décéder lui-même en 2020. Leur héritage artistique continue d'inspirer les générations futures et leur impact sur le monde de l'art et de l'environnement est incontestable.",https://upload.wikimedia.org/wikipedia/commons/thumb/f/f7/Jean-Claude_and_Christo%2C_May_2009_%284%29_%28cropped%29.jpg/1200px-Jean-Claude_and_Christo%2C_May_2009_%284%29_%28cropped%29.jpg
Philippe Decouflé,1961,France,"Philippe Decouflé est un chorégraphe, danseur et metteur en scène français renommé, célèbre pour ses productions innovantes qui combinent danse, théâtre, cirque, et arts visuels. Né le 22 octobre 1961 à Neuilly-sur-Seine, en France, il a étudié à l'École des arts décoratifs de Paris avant de se lancer dans une carrière artistique multidisciplinaire.  Decouflé est surtout connu pour son style distinctif et excentrique, caractérisé par des mouvements fluides, des acrobaties surprenantes, et une esthétique visuelle éclatante. Il est également reconnu pour son utilisation novatrice de la technologie et des effets spéciaux dans ses spectacles, créant ainsi des expériences immersives et fantastiques pour le public.  Parmi ses œuvres les plus célèbres, on trouve la cérémonie d'ouverture des Jeux olympiques d'hiver d'Albertville en 1992, où il a présenté un spectacle spectaculaire qui a marqué les esprits du public du monde entier. Il a également créé de nombreux spectacles pour sa compagnie, DCA (Diversité, Camaraderie, Agilité), ainsi que des productions pour des compagnies de danse et de théâtre prestigieuses à travers le monde.  Decouflé a reçu de nombreux prix et distinctions pour son travail tout au long de sa carrière, et son influence sur le monde de la danse contemporaine et du spectacle vivant est considérable. Il continue à être une figure emblématique de la scène artistique française et internationale, inspirant et captivant les publics avec ses créations originales et inventives.",https://www.resmusica.com/wp-content/uploads/2023/07/une-380x351.jpg
